EVENT CATEGORY,EVENT GROUP,EVENT SUBGROUP,EVENT TYPE,PLACE,EVENT START DATE,COMMENTS,FATALITIES,INJURED / INFECTED,EVACUATED,ESTIMATED TOTAL COST,NORMALIZED TOTAL COST,EVENT END DATE,FEDERAL DFAA PAYMENTS,PROVINCIAL DFAA PAYMENTS,PROVINCIAL DEPARTMENT PAYMENTS,MUNICIPAL COSTS,OGD COSTS,INSURANCE PAYMENTS,NGO PAYMENTS,UTILITY - PEOPLE AFFECTED,MAGNITUDE
Disaster,Natural,Meteorological - Hydrological,Flood,Regional Municipality of Wood Buffalo,4/26/2020 12:00:00 AM,"On April 26th, the Regional Municipality of Wood Buffalo declared a State of Local Emergency when an ice jam caused flooding along the Athabasca, Snye and Clearwater Rivers. The waters rose as high as 4.5-6 m - some within a matter of hours. As a result of the flooding, roughly 13,000 individuals in the lower townsite were evacuated until May 2nd; this one was of the first major evacuations in the world to take place during the pandemic. Over 1,200 structures (mostly commercial) and vehicles were damaged which caused an estimated $549 million (CAD 2020) in insured losses. As a result of the flood, 1 individual was fatally injured and another taken to hospital when the waters quickly rose along the Athabasca River while they were ATVing near Fort McKay First Nation.",1,1,13000,,,5/3/2020 12:00:00 AM,,,,,,549213000,,,
Disaster,Natural,Meteorological - Hydrological,Flood,"Fort Vermilion, Alberta ",4/23/2020 12:00:00 AM,"On April 23rd, Mackenzie County, AB, issued an ice jam watch for the Peace River from Sunny Valley to Fort Vermilion. By the end of the day, the county declared a State of Local Emergency as it was expected that the ice run would reach the community of Fort Vermilion within the day. With this, an evacuation alert was issued for residents in low lying areas in North Vermilion and Fort Vermilion. The watch was soon upgraded to a warning, and the evacuation was expanded to include more of the community. Roughly 450 residents were evacuated. On the morning of 27th, the Peace River breached its banks and began to flood the communities. Flood waters rose 2.5 metres and caused extensive damage to homes, businesses and local infrastructure. The waters receded on April 29th, and residents were allowed home on May 2nd. As a result of the flooding, some homes were damaged beyond repair and are being re-built on higher ground to reduce the risk of future flood losses.",0,0,450,,,5/3/2020 12:00:00 AM,,,,,,,,,
Disaster,Natural,Meteorological - Hydrological,Flood,Eastern Canada,4/18/2019 12:00:00 AM,"Extensive flooding in April and May was experienced across Ontario, Quebec and New Brunswick due to a combination of heavy rainfalls and snow melt. In the Beauce region of Quebec, 154.5 mm of rain fell in April and was one of the first regions to be impacted by the spring floods.",,,,,,,,,,,,,,,
"The most severe flooding took place in Quebec where there were over 10,000 evacuees and over 6,600 flooded homes. One person was killed in Pontiac, QC, after the road washed out. In Sainte-Marthe-sur-le-Lac, a suburb of Montreal in the Deux-Montagnes MRC, a 15-23 m rupture in the natural dyke system forced the immediate evacuation of over 5,000 residents and 50 streets were flooded overnight on April 27-28th. Historical water levels were also experienced at the Chute-Bell hydro dam along Riviere Rouge where 50 residents of Grenville-sur-la-Rouge were evacuated due to fears of a dam failure.",,,,,,,,,,,,,,,,,,,,,
"States of emergency extended across the 3 provinces, including in Ottawa and Montreal. By the end of April, over a dozen states of emergency had been declared along the Ottawa River and its tributaries alone. Around 2,000 Canadian Forces personnel were deployed, which was more than the number deployed overseas.",1,,10000,0,,4/18/2019 12:00:00 AM,,,,,,,,,,,,,,,
Disaster,Natural,Meteorological - Hydrological,Flood,"Kashechewan, Ontario",4/15/2019 12:00:00 AM,"Seasonal flooding along the Albany River forced the evacuation of Kashechewan First Nation, a community of 2,500, to various communities throughout Ontario including Timmins, Kapuskasing, Thunder Bay and Cornwall. The annual evacuation was moved ahead of schedule due to heavy snow.",,,2500,0,,4/15/2019 12:00:00 AM,,,,,,,,,
Disaster,Natural,Meteorological - Hydrological,Flood,Toronto,8/7/2018 12:00:00 AM,"A severe overnight storm produced over 70 mm of rain in Toronto; some localized rainfall measured over 120 mm. The rainfall amounts ranged from +100 mm in North York and the downtown area to only 6 mm at Pearson International Airport. Several people had to be rescued from their vehicles due to the urban flooding. Flooding or flood-related water was also reported in Toronto City Hall, Scotiabank Arena, Rogers Centre, and Union Station. This overnight urban flooding event caused over $80 million in insured losses.",,,,80000000,,8/8/2018 12:00:00 AM,,,,,,80000000,,,
Disaster,Natural,Meteorological - Hydrological,Flood,"Regional District of Kootenay Boundary, British Columbia",5/1/2018 12:00:00 AM,"The combination of heavy rains and snowmelt led to an exceptional flooding event in the Regional District of Kootenay Boundary in the spring of 2018 - the worst since 1948. Several waterways including the Kettle and Granby Rivers overtopped their banks. Roughly 350 members of the Canadian Armed Forces were deployed to assist in the flood efforts. They filled 50,000 sandbags, put 80,500 in place, installed protective dams and barriers as well as constructed and reinforced dykes. As a result of the flood, over 3,200 individuals were evacuated for over 10 days, and over 450 buildings were damage or destroyed. Furthermore, over $20 million (CAD 2018) was spent on response and recovery; indirect costs were estimated to be $26 million (CAD 2018). ",0,0,3200,,,5/31/2018 12:00:00 AM,,,,,,,,,
Disaster,Natural,Meteorological - Hydrological,Flood,New Brunswick,4/27/2018 12:00:00 AM,"In early April, the deep snowpacks in parts of New Brunswick were exposed to over 48 hours of warm temperatures of up to 29C. In addition, a total of 152 mm of rain fell over a period of 31 of 32 days. Widespread flooding in the St. John River basin deeply impacted several communities including its capital of Fredericton. ",,,,,,,,,,,,,,,
"Every community along the St. John River between Fredericton and St. John experienced high water levels. On April 27th, the water level along the St. John River reached flood stage in Fredericton and Maugerville. By April 30th, the river was above flood stage between Fredericton and St. John. The flood peaked on May 6th from Maugerville to Sheffield-Lakeville Corner, and from the latter to St. John on May 7th reaching record-breaking flood stages for most of these stations.",,,,,,,,,,,,,,,,,,,,,
"There were significant disruptions to the transportation network including 150 impacted provincial roads, eroded roadways, weight restrictions on bridges and the closure of parts of the trans-Canada highway between Fredericton and Moncton. According to the Red Cross, as of January 2019, there were 33 individuals still displaced from these floods.",,,,,,,,,,,,,,,,,,,,,
"According to Environment and Climate Change Canada, this flood was the largest and most impactful flood in modern New Brunswick history.",,,1400,0,,5/13/2018 12:00:00 AM,,,,,,,,,,,,,,,
Disaster,Natural,Meteorological - Hydrological,Flood,"Kashechewan First Nation, Ontario",4/25/2018 12:00:00 AM,"In the spring of 2018, annual ice break up and flooding threatened the Kashechewan First Nation, and after declarations of an emergency, the Canadian Armed Forces were requested to assist in the evacuations and monitoring the water levels. Roughly 1,672 residents were evacuated to six host communities; the Red Cross also assisted municipal efforts. ",0,0,1672,,,5/15/2018 12:00:00 AM,,,,,,,,,
Disaster,Natural,Meteorological - Hydrological,Flood,"Grand River, ON",2/16/2018 12:00:00 AM,"The winter of 2018 was one of the coldest on record, which created a very strong icepack throughout the Grand River watershed in Ontario. In addition to this, temperature drops led to the formation of frazil ice – heavy slush in rivers. ",,,,,,,,,,,,,,,
"On February 19th, 40-60 mm of rain fell. The combination of frazil ice, ice jams, 40-60 mm of rain, and 50-70mm of melting snowpack caused the water levels of the Grand River to rise rapidly. Ice jams tended to form in Cambridge, Brantford and Cayuga – in Cambridge the ice jam measured 5 km upstream.",,,,,,,,,,,,,,,,,,,,,
"The Grand River Conservation Authority issued flood warnings for several communities including Brantford, Cambridge, North Dumfries and Brant County. The first warning was issued on February 16th but by February 18th a warning was issued for the entire watershed. ",,,,,,,,,,,,,,,,,,,,,
"Up to 2,200 homes and 4,900 residents were impacted by an evacuation order. In Cambridge, ice and debris damaged city infrastructure, communications and a water main. The City of Brantford declared a State of Emergency. Along the Grand River near Orangeville, a young boy drowned in the floodwaters.",1,,4900,0,,2/21/2018 12:00:00 AM,,,,,,,,,,,,,,,
Disaster,Natural,Meteorological - Hydrological,Flood,"Windsor, Ontario",8/28/2017 12:00:00 AM,"Rain began to fall on August 28th and within 48 hours – 222 mm fell southwest of Windsor, 140-200 mm in Riverside-Tecumseh, and 285 mm in Lasalle. This rain and flood event occurred less than a year after another record setting event in September of 2016. There were almost 2,700 flood-related calls to Windsor’s 311 line. Several public facilities and businesses were also impacted including schools and libraries. Thousands of basements were flooded which resulted in over $173 million in insurance payouts.",,,,173000000,,8/30/2017 12:00:00 AM,,,,,,173000000,,,
Disaster,Natural,Meteorological - Hydrological,Flood,"Mud Lake, Newfoundland and Labrador",5/16/2017 12:00:00 AM,"During the ice cover breakup season, an ice jam formed along the lower Churchill River which affected the nearby Mud Lake. On May 16th, the water levels of Mud Lake in central Labrador began to rise and within 24 hours the levels quickly became unsafe. By May 19th, all residents except one had been evacuated to Happy Valley-Goose Bay. The Canadian Armed Forces assisted in the evacuation effort including opening a temporary shelter for some of the displaced individuals; 18 individuals stayed until December 12th. The water receded by May 22.",0,0,68,,,5/22/2017 12:00:00 AM,,,,,,,,,
Disaster,Natural,Meteorological - Hydrological,Flood,Eastern Canada,5/4/2017 12:00:00 AM,"A combination of significant rainfall from May 4-7, overland flow, and high water levels led to extensive flooding across in parts of eastern Canada. Montreal and the National Capital Region experienced their wettest springs in recorded history with over +400 mm of rainfall. Several communities declared States of Emergency including Gatineau, Montreal, and many smaller towns. The Canadian military deployed 4,000 personnel to help with the flood efforts. The event caused significant losses including over $116 million in insured damage, and 550 damaged roads. Two people were killed in floodwaters in the Sainte-Anne River (Gaspe region).",2,,4000,116000000,,5/7/2017 12:00:00 AM,,,,,,116000000,,,
Disaster,Natural,Meteorological - Hydrological,Flood,British Columbia,4/27/2017 12:00:00 AM,"Following a relatively cold and dry winter, the Southern Interior region of British Columbia experienced a wetter than average spring. A late snowfall and rain accumulation led to saturated soils, overland flow, and slope instability throughout areas of the south and central Okanagan as well as the Kootenay and Shuswap regions. The flooding led to 2,500 evacuations which were mostly from the Okanagan. Numerous States of Local Emergencies were declared. 15 First Nation communities were impacted where the flooding damaged homes and infrastructure. The flood response costs alone were estimated to be $73 million.",,,2500,0,,6/15/2017 12:00:00 AM,,,,,,,,,
Disaster,Natural,Meteorological - Hydrological,Flood,"Kashechewan First Nation, Ontario",4/16/2017 12:00:00 AM,"In the spring of 2017, the rising water levels of the Albany River was threatening the Kashechewan First Nation. After declaring a state of emergency, roughly 500 residents were evacuated as a precaution. The Canadian Armed Forces aided in the evacuations as well as monitoring the river levels.",0,0,500,,,5/1/2017 12:00:00 AM,,,,,,,,,
Disaster,Natural,Meteorological - Hydrological,Flood,Red Earth First Nation SK,11/14/2016 12:00:00 AM,"Red Earth First Nation SK, July 14-18, 2016. Heavy rain resulted in the flooding of the Carrot River in northern Saskatchewan. The community of Red Earth Cree Nation, located 75 kilometres east of Nipawin, declared a state of emergency and was forced to evacuate 576 residents. The majority of evacuees stayed in Saskatoon at the Henk Ruy’s Soccer Centre, while others stayed in hotels or with family. The communities of Carrot River and the rural municipalities of Moose Range and Arborfield also declared states of emergency but were less impacted by the flood.",,,576,0,0,11/18/2016 12:00:00 AM,,,,,,,,,
Disaster,Natural,Meteorological - Hydrological,Flood,"Nova Scotia, Prince Edward Island and Newfoundland",10/9/2016 12:00:00 AM,"Nova Scotia, Prince Edward Island and Newfoundland, October 9-13, 2016. Atlantic Canada was hit with heavy rain as a result of the remnants of Hurricane Matthew. Wind and heavy rainfall warnings were in affect from October 10 to 11 for northeastern Nova Scotia and Newfoundland. On October 10, 150 mm of rain fell on Newfoundland. The town of Burgeo alone received 120 mm of rain, which caused the closure of Highway 480. St-Alban’s declared a state of emergency due to various road closures including the Swanger’s Cove Bridge on route 361, which was reported to have been damaged and was deemed unusable by the Newfoundland Public Safety Regional Office. Road closures in St-Alban’s resulted in the isolation of numerous homes. In Nova Scotia, over 220 mm of rain was reported across the province. The J.A. Douglas McCurdy Sydney Airport was forced to close all runways. Cape Breton was hard hit by the heavy rain, which resulted in property damage to approximately 300 homes. Most severely impacted was Eskasoni First Nation where 100 homes were flooded and an undetermined number of people evacuated due to high water levels. On October 11, there were 16 states of emergency in Newfoundland where Bager and Gander received 131 mm and 124 mm of rain. While there no states of emergency declared in Nova Scotia, NS Power reported that approximately 130,000 customers (390,000 individuals) had experienced power outages. Prince Edward Island received 73 mm of rain, which left approximately 600 residents without power. Ferries in Nova Scotia and Newfoundland were closed due to eight-metre high waves caused by the storm. The Canadian Armed Forces assisted with sandbagging efforts as water levels continued to rise until October 12. It was not until October 13 when water levels began to drop in certain areas, however in Newfoundland water levels remained at a record high. Power was restored to all customers in Nova Scotia and Prince Edward Island by October 13.",,,,30350000,1418224.3,10/13/2016 12:00:00 AM,30350000,,,,,,,390600,
Disaster,Natural,Meteorological - Hydrological,Flood,Windsor and Tecumseh ON,9/29/2016 12:00:00 AM,"Windsor and Tecumsech ON, September 29, 2016. States of emergency were declared in Windsor and Tecumsech after the region was hit with intense storms that produced significant flooding. The Windsor Airport recorded 78 mm of rain within a 24-hour period, while another gauge in the city’s east end measured 106 mm and the town of Tecumsech received up to 190 mm. In both municipalities, the heavy rain resulted in hundreds of flooded basements. Cars were abandoned in flooded streets and many roads were closed.",,,,0,0,9/29/2016 12:00:00 AM,,,,,,,,,
Disaster,Natural,Meteorological - Hydrological,Flood,Fort McMurray AB,7/30/2016 12:00:00 AM,"Fort McMurray AB, July 30-31 2016. Only weeks after the devastating wildfire that swept through the Regional Municipality of Wood Buffalo, the city of Fort McMurray was struck by a flash flood, which caused damages to personal property as well as disrupted local traffic and recovery efforts. On July 31, Fort McMurray received up to 85 mm of rain, which caused significant damages to approximately 41 homes. The flood occurred at a time when Fort McMurray was undergoing recovery efforts in response to the May wildfires that caused the evacuation of the entire city. The flash flood also caused road closures and knocked out power to traffic lights.",,,,462528000,21613457.9,7/31/2016 12:00:00 AM,,,,,,462528000,,,
Disaster,Natural,Meteorological - Hydrological,Flood,Kenora ON,6/27/2016 12:00:00 AM,"Kenora ON, June 27-28, 2016. Two states of emergency were declared in Kenora due to flooding that resulted in over 20 roads experiencing moderate to extensive damages. On June 27, the first state of emergency was declared after Kenora received more than 109 mm of rain over a two-day period. The main road into the city, Veterans Drive, was completely washed out and subsequently closed. A second state of emergency was declared on June 28.",,,,0,0,6/28/2016 12:00:00 AM,,,,,,,,,
Disaster,Natural,Meteorological - Hydrological,Flood,Northeastern British Columbia,6/15/2016 12:00:00 AM,"Northeastern British Columbia, June 15-17, 2016. Heavy rainfall throughout the Peace River region in northeastern British Columbia caused flooding in several communities. The district of Chetwynd declared a local state of emergency on June 15 after Chetwynd had received a total of 134.8 mm of rain over a two-day period. A section of Highway 97, the only route that connects the region of Peace River to the rest of the province, was closed due to flooding. The hardest hit by the flooding was the city of Dawson Creek where up to 98.6 mm of rain fell over a two-day period. In Dawson Creek, 60 people evacuated their homes due to flood waters that damaged approximately 400 homes, destroyed one bridge and submerged two others. The flooding in Dawson Creek cut the city in half, leaving residents in the south end of the city without power as well as separating the hospital from the fire hall, which created a challenge for emergency responders. In total, over 2000 homes and businesses (approximately 6000 individuals) were without power throughout the Peace River region as of June 15.",,,60,65132000,3043551.4,6/17/2016 12:00:00 AM,65132000,,,,,,,6000,
Disaster,Natural,Meteorological - Hydrological,Flood,Kashechewan First Nation ON,4/27/2016 12:00:00 AM,"Kashechewan First Nation ON, April 27-30, 2016. The chief of Kashechewan First Nation declared a state of emergency on April 27 due to annual spring ice break up, snowmelt and subsequent run off in the James Bay coast. In total, 1,207 residents out of the 1,600 residents who live in the northern Ontario reserve evacuated their homes in multiple stages of evacuations that took place from April 29-30. Evacuees were taken to Kapuskasing and Thunder bay.",,,1207,0,0,4/30/2016 12:00:00 AM,,,,,,,,,
Disaster,Natural,Meteorological - Hydrological,Flood,Chestermere AB,7/12/2015 12:00:00 AM,"Chestermere AB, July 12, 2015. Flooding occurred in the town of Chestermere were it rain 223 mm in only a few hours. The huge amount of rain that fell on the town resulted in overland flooding. In Chestermere, the basements of approximately 300 homes were flooded due to overland flooding, sewer backups or sump pump failure. In some cases, water levels of up to eight feet were reported in residential basements. In addition, vehicles in the street were nearly submerged in water. Lighting accompanied by the storm caused power outages that affected approximately 20,000 people. The power outages are believed to have led to the severity of basement flooding.",,,,0,0,7/12/2015 12:00:00 AM,,,,,,,,20000,
Disaster,Natural,Meteorological - Hydrological,Flood,Perth-Andover NB,4/18/2015 12:00:00 AM,"Perth-Andover NB, April 18-20, 2015. Perth-Andover experienced significant flooding due to a massive ice jam that broke apart on the St. John and Tobique Rivers. Ice congested local waterways near the village of Perth-Andover causing water levels to rise. The flooding forced 300 people to evacuate. The Canadian Red Cross assisted with the evacuation order. Many businesses closed down, including schools and the local hospital where 23 patients staying at the Hotel Dieu of St. Joseph had to be relocated. Route 105, the major road into Perth-Andover, was closed due to the risk of overland flooding.",,,300,0,0,4/20/2015 12:00:00 AM,,,,,,,,,
Disaster,Natural,Meteorological - Hydrological,Flood,Fort Albany and Kashcewan First Nation,4/17/2015 12:00:00 AM,"Fort Albany and Kashechewan First Nation ON, April 17 to May 11, 2015. The annual spring melt resulted in high water levels in the Albany River, which caused severe flooding for communities in the James Bay region. A state of emergency was declared on April 17, for the Kashechewan First Nation, which is situated in the mouth of the Albany River on the shores of James Bay. The community of Fort Albany also declared a state of emergency on April 29. Evacuations in Kashechewan began April 25, where 1,320 residents were air lifted to safety. In Fort Albany, 13 hospital patients were also evacuated by air. On April 27, the Ontario government issued a Request for Federal Assistance (RFA) for aircrafts in response to the flood in order to evacuate the remaining residents. The community of Moose Cree First Nation was also affected but no evacuations took place. In total, 1,333 people were evacuated to Kapuskasing, Smooth Rock Falls, Wawa and Cornwall. Some residents were permanently displaced due to mold and poor living conditions brought on by the reoccurring floods. Evacuation efforts were complete by April 28.",,,1333,0,0,5/11/2015 12:00:00 AM,,,,,,,,,
Disaster,Natural,Meteorological - Hydrological,Flood,Southern Manitoba,6/25/2014 12:00:00 AM,"Southern Manitoba, June 25 to July 14, 2014. After a relatively quiet spring flood season, heavy rainfall in Western Manitoba and Saskatchewan led to record flows and flooding along the Assiniboine, Qu’Appelle and Souris Rivers. Up to 200 mm of rain fell in some municipalities. Over 43 local states of emergency were declared followed by a provincial state of emergency and formal request for federal assistance on July 4. Approximately 300 Canadian Armed Forces personnel deployed from CFB Shilo to help flood recovery efforts. The Portage Diversion was opened near Portage la Prairie to direct flows from the Assiniboine river into Lake Manitoba. In total, approximately 560 people were evacuated from their homes. The Government of Manitoba estimates that over 920,000 acres of farm land went unseeded for the 2014 season, representing 25 percent of arable acres in Manitoba with an associated estimated cost of over $1 billion dollars. ",,,,,,,,,,,,,,,
,,,,,,,,,,,,,,,,,,,,,
"*Note: A request for federal assistance through the DFAA program has been made; however, no payments have yet been issued.",0,0,560,1164679000,55815287.5,7/14/2014 12:00:00 AM,164679000,,,,,1000000000,,,,,,,,,
Disaster,Natural,Meteorological - Hydrological,Flood,Southern Saskatchewan,6/25/2014 12:00:00 AM,"Southern Saskatchewan, June 25 to July 14, 2014. Heavy rain across southeastern Saskatchewan led to localized overland flooding, road washouts, highway closures, and local power outages. The affected basins were the Souris, Lower Qu’Appelle and Assiniboine. Some areas in southeastern Saskatchewan reported up to 240 mm of precipitation in less than two days. Over 68 municipalities declared local states of emergency. In Melville, St. Peter’s hospital evacuated 150 acute care patients due to rising flood waters. The Trans-Canada Highway was washed out in several sections and CN rail was heavily impacted on its regional lines. Peak flow levels on the Assiniboine and Qu’Appelle rivers exceeded that of the 2011 flood.",0,0,500,19387000,929089.5,7/14/2014 12:00:00 AM,19387000,,,,,,,,
Disaster,Natural,Meteorological - Hydrological,Flood,Southern Alberta,6/15/2014 12:00:00 AM,"Southern Alberta, June 15 to July 30, 2014. Significant rainfall in southern Alberta led to overland flooding and evacuations along the Oldman, St. Mary, Belly and Waterton rivers. Twelve municipalities declared local states of emergency and over 500 people were evacuated throughout the province. The most significant evacuations came from the Blood Tribe Reserve First Nation, where 435 people were evacuated due to flooding and infrastructure failures.",,,,,,,,,,,,,,,
,,,,,,,,,,,,,,,,,,,,,
"Note: A request for federal assistance through the DFAA program has been made; however, no payments have yet been issued.",0,0,500,0,0,7/30/2014 12:00:00 AM,,,,,,,,,,,,,,,
Disaster,Natural,Meteorological - Hydrological,Flood,"James Bay, Ontario",5/7/2014 12:00:00 AM,"In the spring of 2014, the ice breakup and flooding along the southwestern shorelines of James Bay and its tributary rivers were threatening several communities. On May 7th, the Canadian Armed Forces began to assist in the evacuation of communities in the James Bay region including Kashechewan, Fort Albany, and Attawapiskat. Evacuation operations continued in the region for almost two weeks. As a result of flooding and sewer back-ups, 40 buildings were damaged. Roughly 2,000 residents in several communities were evacuated.",0,0,2000,,,5/20/2014 12:00:00 AM,,,,,,,,,
